{
  "citations": [
    {
      "title": "",
      "url": "https://en.wikipedia.org/wiki/Bored_Ape"
    },
    {
      "title": "",
      "url": "https://x.com/yugalabs?lang=en"
    },
    {
      "title": "",
      "url": "https://www.makemepulse.com/case-study/the-bored-ape-yacht-club"
    },
    {
      "title": "",
      "url": "https://otherside.xyz"
    },
    {
      "title": "",
      "url": "https://ocula.com/magazine/art-news/bored-apes-creators-acquire-cryptopunks-ip/"
    },
    {
      "title": "",
      "url": "https://www.gucci.com/us/en/st/stories/article/otherside-relics-by-gucci"
    },
    {
      "title": "",
      "url": "https://lex.substack.com/p/defi-yuga-labs-and-magic-edens-royalty"
    },
    {
      "title": "",
      "url": "https://www.scmp.com/news/hong-kong/health-environment/article/3240973/organiser-hong-kong-nft-event-says-eye-pain-reported-some-party-goers-may-be-due-uva-light-exposure"
    },
    {
      "title": "",
      "url": "https://unchainedcrypto.com/cryptopunks-bayc-nft-creator-yuga-labs-cuts-jobs-amid-restructuring-just-18-months-after-450m-seed-round/"
    },
    {
      "title": "",
      "url": "https://x.com/coingecko/status/2047925429504278836"
    },
    {
      "title": "",
      "url": "https://thedefiant.io/news/hacks/yuga-labs-white-hat-rescue-68-nfts-flooring-protocol-exploit"
    },
    {
      "title": "",
      "url": "https://x.com/DecryptMedia/status/2064096504063693022"
    },
    {
      "title": "",
      "url": "https://cryptoslate.com/yuga-moves-to-kill-apecoin-dao-transfer-168m-in-assets-to-new-entity/"
    },
    {
      "title": "",
      "url": "https://x.com/CoinDesk/status/1930916788373463279"
    },
    {
      "title": "",
      "url": "https://x.com/EricCLFung/status/2015219361636913229"
    },
    {
      "title": "",
      "url": "https://www.instagram.com/p/DZbRgcpD7Bo/"
    },
    {
      "title": "",
      "url": "https://coinstats.app/news/08f9bd8315f7858b8595b90e404bf3eee3a6d4878522277f195138628e1b54bf_Yuga-Labs-Rescues-68-HighValue-NFTs-From-Flooring-Protocol-Exploit"
    }
  ],
  "schema_version": 1,
  "slug": "yuga-labs",
  "summary": "A privately held web3 studio best known for creating the **Bored Ape Yacht Club** NFT collection, Yuga Labs has become a bellwether for how intellectual property, token communities, and metaverse ambitions intersect on Ethereum. Through high-profile acquisitions, legal battles, governance experiments, and security inte"
}
