{
  "citations": [
    {
      "title": "",
      "url": "https://www.investopedia.com/non-fungible-tokens-nft-5115211"
    },
    {
      "title": "",
      "url": "https://nftnow.com/guides/ethereum-and-nfts-a-comprehensive-guide-for-beginners-and-experts/"
    },
    {
      "title": "",
      "url": "https://www.rootsanalysis.com/nft-market"
    },
    {
      "title": "",
      "url": "https://blocksurvey.io/web3-guides/top-nft-marketplaces"
    },
    {
      "title": "",
      "url": "https://www.sec.gov/newsroom/press-releases/2023-163"
    },
    {
      "title": "",
      "url": "https://thedefiant.io/news/defi/opensea-teases-hyperliquid-powered-perpetuals-launch"
    },
    {
      "title": "",
      "url": "https://www.binance.com/en/square/post/330178990115553"
    },
    {
      "title": "",
      "url": "https://thedefiant.io/news/hacks/yuga-labs-white-hat-rescue-68-nfts-flooring-protocol-exploit"
    },
    {
      "title": "",
      "url": "https://www.instagram.com/reel/DX9Zv9uO7x1/"
    },
    {
      "title": "",
      "url": "https://bitcoinfoundation.org/news/nft/pudgy-party-closes-fall-guys-style-game/"
    },
    {
      "title": "",
      "url": "https://ethereum.org/developers/docs/standards/tokens/erc-721/"
    },
    {
      "title": "",
      "url": "https://ethereum.org/developers/docs/standards/tokens/erc-1155/"
    },
    {
      "title": "",
      "url": "https://www.block3finance.com/the-economics-of-nft-minting-costs-gas-fees-and-profitability-explained"
    },
    {
      "title": "",
      "url": "https://chain.link/education-hub/ordinals-bitcoin-nfts"
    },
    {
      "title": "",
      "url": "https://www.nftfi.com"
    },
    {
      "title": "",
      "url": "https://www.myartbroker.com/investing/articles/nft-crash-and-crypto-winter-2022"
    },
    {
      "title": "",
      "url": "https://www.youtube.com/watch?v=hjni_LsQ70w"
    },
    {
      "title": "",
      "url": "https://bitcoinfoundation.org/news/crypto-companies-news/binance-nft-users-get-one-month-to-withdraw-assets/"
    },
    {
      "title": "",
      "url": "https://www.producthunt.com/categories/nft-creation"
    }
  ],
  "schema_version": 1,
  "slug": "nft",
  "summary": "Comprehensive explainer on NFTs for crypto readers, covering how non-fungible tokens work, Ethereum and Bitcoin standards, minting and markets, DeFi integration, 2021–22 boom and crash, regulation, security risks, and long-term use cases beyond speculation."
}
