{
  "citations": [
    {
      "title": "",
      "url": "https://www.binance.com/en/how-to-buy/2026-memes"
    },
    {
      "title": "",
      "url": "https://en.wikipedia.org/wiki/Binance"
    },
    {
      "title": "",
      "url": "https://www.binance.com/en/launchpool"
    },
    {
      "title": "",
      "url": "https://www.cftc.gov/PressRoom/PressReleases/8825-23"
    },
    {
      "title": "",
      "url": "https://www.binance.com/en/proof-of-reserves"
    },
    {
      "title": "",
      "url": "https://www.binance.com/en/square/post/310673971107937"
    },
    {
      "title": "",
      "url": "https://www.sec.gov/newsroom/press-releases/2023-101-sec-files-13-charges-against-binance-entities-founder-changpeng-zhao"
    },
    {
      "title": "",
      "url": "https://www.facebook.com/SenBlumenthal/posts/binance-has-reportedly-facilitated-billions-of-dollars-for-iranian-sanctions-eva/1504515604362512/"
    },
    {
      "title": "",
      "url": "https://www.binance.com/en-TR/square/post/336444392434146"
    },
    {
      "title": "",
      "url": "https://cryptonews.net/news/market/31994497/"
    },
    {
      "title": "",
      "url": "https://info.arkm.com/research/bhutan-selling-btc"
    },
    {
      "title": "",
      "url": "https://www.binance.com/en/support/announcement/79bfc2e1c5f943e79d485c8ea87b2794"
    },
    {
      "title": "",
      "url": "https://x.com/WuBlockchain/status/2067401054493589705"
    },
    {
      "title": "",
      "url": "https://www.binance.com/en/support/announcement/detail/d4bfeee372e84c9e9fa70558c547a510"
    },
    {
      "title": "",
      "url": "https://www.binance.com/en/support/announcement/detail/a6f02526afd1466ab72fe29af4c84c67"
    },
    {
      "title": "",
      "url": "https://fr.tradingview.com/news/cointelegraph:852241e84094b:0-binance-eyes-philippines-return-through-sec-sandbox-partnership/"
    },
    {
      "title": "",
      "url": "https://www.binance.com/en/support/announcement/detail/d7a82549cf41442c8654e720eee656ad"
    },
    {
      "title": "",
      "url": "https://www.binance.com/eoptions-data/XRPUSDT/oi-volume"
    },
    {
      "title": "",
      "url": "https://en.wikipedia.org/wiki/Richard_Teng"
    },
    {
      "title": "Consumer warning on Binance Markets Limited and the Binance Group | FCA",
      "url": "https://www.fca.org.uk/news/news-stories/consumer-warning-binance-markets-limited-and-binance-group"
    },
    {
      "title": "Binance to plan UK relaunch with FCA license application: Report",
      "url": "https://cointelegraph.com/news/binance-uk-launch-plans-fca-license"
    },
    {
      "title": "Cryptoassets: How the gateway will operate | FCA",
      "url": "https://www.fca.org.uk/firms/new-regime-cryptoasset-regulation/how-gateway-will-operate"
    },
    {
      "title": "Binance plans UK return with FCA license bid: report",
      "url": "https://crypto.news/binance-plans-uk-return-with-fca-license-bid/"
    }
  ],
  "schema_version": 1,
  "slug": "binance",
  "summary": "Binance is simultaneously a dominant exchange, derivatives venue, token-distribution platform, Web3 gateway, and regulatory test case. Its scale creates deep liquidity and broad access, but also concentrates custody, compliance, and market-structure risk."
}
