{
  "citations": [
    {
      "title": "",
      "url": "https://bitcoinfoundation.org/news/altcoins/how-to-buy-solana-sol-in-2026-full-beginners-guide/"
    },
    {
      "title": "",
      "url": "https://solana.com/news/proof-of-history"
    },
    {
      "title": "",
      "url": "https://sqmagazine.co.uk/solana-statistics/"
    },
    {
      "title": "",
      "url": "https://www.helius.dev/blog/solana-outages-complete-history"
    },
    {
      "title": "",
      "url": "https://solanacompass.com/tokenomics"
    },
    {
      "title": "",
      "url": "https://www.helius.dev/blog/solana-local-fee-markets"
    },
    {
      "title": "",
      "url": "https://www.tradingview.com/news/coinpedia:f02307394094b:0-solana-s-firedancer-goes-live-on-mainnet-after-3-years-sol-jumps-by-6/"
    },
    {
      "title": "",
      "url": "https://solana.com"
    },
    {
      "title": "",
      "url": "https://www.facebook.com/CoinMarketCap/posts/latest-morgan-stanley-disclosed-a-014-fee-in-amended-filings-for-its-proposed-et/1430024635821592/"
    },
    {
      "title": "",
      "url": "https://www.cmegroup.com/markets/cryptocurrencies/indices/nasdaq-cme-crypto-index.html"
    },
    {
      "title": "",
      "url": "https://x.com/coinbase/status/2067742013504750074"
    },
    {
      "title": "",
      "url": "https://x.com/WuBlockchain/status/2066989377797206343"
    },
    {
      "title": "",
      "url": "https://x.com/SynapseProtocol/status/2064997713502937119"
    },
    {
      "title": "",
      "url": "https://x.com/lookonchain/status/2062736598018478445"
    },
    {
      "title": "",
      "url": "https://solana.com/news/state-compression-compressed-nfts-solana"
    },
    {
      "title": "",
      "url": "https://eco.com/support/en/articles/15083165-best-solana-liquid-staking-comparison"
    },
    {
      "title": "",
      "url": "https://x.com/triton_one/status/2062723713674666270"
    },
    {
      "title": "",
      "url": "https://www.vaasblock.com/news/solana-etf-approval-2026-sec-institutional/"
    },
    {
      "title": "",
      "url": "https://eco.com/support/en/articles/15083170-best-solana-defi-protocols-2026"
    },
    {
      "title": "",
      "url": "https://atomicwallet.io/academy/articles/bitcoin-ethereum-and-solana-price-forecasts-and-market-analysis-for-2026"
    }
  ],
  "schema_version": 1,
  "slug": "sol",
  "summary": "Comprehensive explainer on SOL, the native token of the Solana blockchain, covering technology, tokenomics, DeFi use, derivatives, ETF prospects, risks, and comparisons with BTC, ETH, XRP and USDC for a crypto‑savvy news audience."
}
