{
  "citations": [
    {
      "title": "",
      "url": "https://help.1inch.com/en/articles/8519271-what-are-the-benefits-of-using-1inch-fusion"
    },
    {
      "title": "",
      "url": "https://www.halborn.com/blog/post/explained-the-1inch-hack-march-2025"
    },
    {
      "title": "",
      "url": "https://quant.network/news/a-new-category-of-infrastructure-the-fusion-rollup-is-live-on-mainnet/"
    },
    {
      "title": "",
      "url": "https://x.com/Genfinity/status/2061862147383079120"
    },
    {
      "title": "",
      "url": "https://x.com/ipor_io/status/1778317797803655368"
    },
    {
      "title": "",
      "url": "https://ipor.io"
    },
    {
      "title": "",
      "url": "https://tpicap.com/tpicap/media/press-releases/2026/tp-icaps-fusion-digital-assets-announces-strategic-evolution-matched-principal-model-improving-operational-and-capital-efficiency"
    },
    {
      "title": "",
      "url": "https://x.com/ipor_io/article/2038960123066892489"
    },
    {
      "title": "",
      "url": "https://quant.network/news/world-first-quant-fusion-multi-ledger-rollup-launches-on-quants-10th-anniversary/"
    },
    {
      "title": "",
      "url": "https://x.com/KnowledgeUpOnly/status/2061865674117423127"
    },
    {
      "title": "",
      "url": "https://www.digitalassetsedge.com/digitalassetsedgenews/industryarticle.php?article_id=228539"
    },
    {
      "title": "",
      "url": "https://fusion.ipor.io"
    },
    {
      "title": "",
      "url": "https://x.com/ipor_io/status/1981702701722325137"
    },
    {
      "title": "",
      "url": "https://x.com/Marco_112358"
    },
    {
      "title": "",
      "url": "https://1inch.com"
    },
    {
      "title": "",
      "url": "https://business.1inch.com/portal/documentation/resolvers/introduction"
    },
    {
      "title": "",
      "url": "https://1inch.com/blog/post/vulnerability-discovered-in-resolver-contract"
    }
  ],
  "schema_version": 1,
  "slug": "fusion",
  "summary": "Deep explainer on “Fusion” in crypto, covering 1inch’s MEV‑protected swaps, IPOR’s institutional vault engine, Quant’s multi‑ledger Fusion Rollup, and TP ICAP’s Fusion Digital Assets platform, plus implications for USDC, DeFi, and tokenized portfolios."
}
