{
  "citations": [
    {
      "title": "",
      "url": "https://www.youtube.com/watch?v=ZwSrORDoCeE"
    },
    {
      "title": "",
      "url": "https://en.wikipedia.org/wiki/Tron_(blockchain)"
    },
    {
      "title": "",
      "url": "https://developers.tron.network/docs/concensus"
    },
    {
      "title": "",
      "url": "https://developers.tron.network/docs/resource-model"
    },
    {
      "title": "",
      "url": "https://en.wikipedia.org/wiki/Justin_Sun"
    },
    {
      "title": "",
      "url": "https://cryptorank.io/insights/research/tron-h-1-2025"
    },
    {
      "title": "",
      "url": "https://defillama.com/stablecoins/tron"
    },
    {
      "title": "",
      "url": "https://atomicwallet.io/academy/articles/what-is-usdd"
    },
    {
      "title": "",
      "url": "https://x.com/skinnydefi/status/2062645616271040923"
    },
    {
      "title": "",
      "url": "https://justlend.org"
    },
    {
      "title": "",
      "url": "https://chainspect.app/compare/tron-vs-ethereum"
    },
    {
      "title": "",
      "url": "https://www.youtube.com/watch?v=zo_cUsrLfJ0&vl=en-US"
    },
    {
      "title": "",
      "url": "https://www.safepal.com/en/blog/stake-trx-safepal-xyswap-earn-10apy"
    },
    {
      "title": "",
      "url": "https://www.newsfilecorp.com/release/293167/TRX-Listing-Launches-on-Binance.US-Advancing-U.S.-Market-Access-to-TRON"
    },
    {
      "title": "",
      "url": "https://www.anchorage.com"
    },
    {
      "title": "",
      "url": "https://x.com/Arielessayshelp/status/2053880533180940354"
    },
    {
      "title": "",
      "url": "https://www.anchorage.com/insights/anchorage-digital-adds-support-for-tron-with-institutional-custody-and-staking-infrastructure"
    },
    {
      "title": "",
      "url": "https://www.tradingview.com/news/coinpedia:a7b3c09ac094b:0-anchorage-digital-adds-tron-custody-opens-institutional-trx-access/"
    },
    {
      "title": "",
      "url": "https://www.tradingview.com/news/coinpedia:5efc64681094b:0-grayscale-releases-36-altcoin-watchlist-for-q1-2026/"
    }
  ],
  "schema_version": 1,
  "slug": "trx",
  "summary": "Deep dive explainer on TRX, the native token of Tron, covering its role in stablecoin rails, staking and DeFi, institutional adoption, governance, risks, and how Tron’s low‑cost DPoS network competes with Ethereum in the stablecoin era."
}
