{
  "citations": [
    {
      "title": "",
      "url": "https://www.darktrace.com/cyber-ai-glossary/crypto-cybersecurity"
    },
    {
      "title": "",
      "url": "https://research.google/blog/safeguarding-cryptocurrency-by-disclosing-quantum-vulnerabilities-responsibly/"
    },
    {
      "title": "",
      "url": "https://blog.google/innovation-and-ai/technology/safety-security/cryptography-migration-timeline/"
    },
    {
      "title": "",
      "url": "https://www.binance.com/en/square/post/336139273882034"
    },
    {
      "title": "",
      "url": "https://www.bloomberg.com/news/articles/2026-06-14/crypto-token-s-50-wipeout-shows-magnitude-of-ai-hacking-threat"
    },
    {
      "title": "",
      "url": "https://x.com/CertiK/status/2062157353701482729"
    },
    {
      "title": "",
      "url": "https://coinpedia.org/news/g7-labels-north-koreas-crypto-thefts-a-global-security-threat/"
    },
    {
      "title": "",
      "url": "https://www.microsoft.com/en-us/security/blog/2026/06/17/crypto-clipper-uses-tor-worm-like-propagation-for-persistence-control/"
    },
    {
      "title": "",
      "url": "https://www.nccoe.nist.gov/applied-cryptography/migration-to-pqc"
    },
    {
      "title": "",
      "url": "https://x.com/DecryptMedia/status/2062021896246272089"
    },
    {
      "title": "",
      "url": "https://www.zerotier.com/blog/harvest-now-decrypt-later-the-breach-already-happened-you-just-havent-seen-it-yet/"
    },
    {
      "title": "",
      "url": "https://coinmarketcap.com/academy/article/%20jpmorgan-citi-tokenized-bank-network-2027"
    },
    {
      "title": "",
      "url": "https://x.com/WuBlockchain/status/2061662229850886564"
    },
    {
      "title": "",
      "url": "https://www.anthropic.com/news/AI-enabled-cyber-threats-mitre-attack"
    },
    {
      "title": "",
      "url": "https://www.certik.com/skynet-report/skynet-2026-stablecoin-threat-intelligence-report"
    },
    {
      "title": "",
      "url": "https://www.instagram.com/reel/DVfYGHDjxoB/?hl=en"
    },
    {
      "title": "",
      "url": "https://www.nist.gov/news-events/news/2024/08/nist-releases-first-3-finalized-post-quantum-encryption-standards"
    },
    {
      "title": "",
      "url": "https://x.com/BankXRP/status/2062918619558813792"
    },
    {
      "title": "",
      "url": "https://owasp.org/www-community/Threat_Modeling"
    },
    {
      "title": "",
      "url": "https://www.trmlabs.com/reports-and-whitepapers/2026-crypto-crime-report"
    }
  ],
  "schema_version": 1,
  "slug": "threat",
  "summary": "In crypto, “threat” spans malware, state-backed hacks, AI and quantum risks, as well as regulatory and systemic pressures on Bitcoin and stablecoins. This explainer defines threats, shows how they shape digital asset security, and outlines emerging defenses and migration plans."
}
