{
  "citations": [
    {
      "title": "",
      "url": "https://www.gsr.io"
    },
    {
      "title": "",
      "url": "https://www.gsr.io/services/trading-market-making"
    },
    {
      "title": "",
      "url": "https://x.com/GSR_io/status/2064468077660836193"
    },
    {
      "title": "",
      "url": "https://x.com/GSR_io/status/2046942228468093214"
    },
    {
      "title": "",
      "url": "https://www.gsr.io/insights/gsr-acquires-autonomous-and-architech-to-launch-integrated-capital-markets-and-treasury-platform-for-crypto"
    },
    {
      "title": "",
      "url": "https://scventures.io/gsr-secures-strategic-investment-from-sc-ventures-to-accelerate-institutional-digital-asset-markets/"
    },
    {
      "title": "",
      "url": "https://www.zama.org/post/the-confidentiality-layer-bringing-institutional-trade-execution-to-ethereum-with-gsr"
    },
    {
      "title": "",
      "url": "https://www.gsr.io/insights/gsr-leads-100m-private-placement-into-nasdaq-listed-mei-pharma-to-launch-first-institutional-litecoin-treasury-strategy-alongside-charlie-lee"
    },
    {
      "title": "",
      "url": "https://ir.upexi.com/news-events/press-releases/detail/104/correction-from-source-upexi-purchases-45733-solana"
    },
    {
      "title": "",
      "url": "https://blog.soniclabs.com/sonic-labs-and-gsr-partner-to-scale-liquidity-strategy-and-ecosystem-growth/"
    },
    {
      "title": "",
      "url": "https://www.facebook.com/forbes/posts/london-based-gsr-one-of-cryptos-largest-market-makers-has-agreed-to-acquire-equi/1179035994086389/"
    },
    {
      "title": "",
      "url": "https://www.nasdaq.com/market-activity/etf/beso"
    },
    {
      "title": "",
      "url": "https://x.com/GSR_io/status/2061724565311459656"
    },
    {
      "title": "",
      "url": "https://polygon.technology/blog/katana-foundation-announces-katana-network-incubated-by-polygon-labs-and-gsr"
    },
    {
      "title": "",
      "url": "https://www.rootdata.com/projects/detail/GSR?k=NDA3OQ%3D%3D"
    }
  ],
  "schema_version": 1,
  "slug": "gsr",
  "summary": "Deep explainer on GSR’s evolution from crypto market maker to capital markets platform, covering its ETFs, PIPE deals, SC Ventures alliance, tokenization push, broker-dealer move, DeFi roles, and impact on institutional adoption."
}
