{
  "citations": [],
  "schema_version": 1,
  "slug": "morgan-stanley",
  "summary": "Morgan Stanley has moved from cautious observer to active crypto participant via its 0.14%-fee Bitcoin ETF (MSBT), pending ETH/SOL ETF filings, and E*Trade spot trading at 0.50% — reshaping institutional and retail crypto access."
}
