{
  "citations": [
    {
      "title": "",
      "url": "https://sites.lsa.umich.edu/mje/2025/01/08/peso-preservation-argentinas-embrace-of-stablecoins-for-economic-stability/"
    },
    {
      "title": "",
      "url": "https://igamingbusiness.com/legal-compliance/regulation/argentine-judge-orders-nationwide-block-on-polymarket-app-store-removal/"
    },
    {
      "title": "",
      "url": "https://en.wikipedia.org/wiki/$Libra_cryptocurrency_scandal"
    },
    {
      "title": "",
      "url": "https://www.prnewswire.com/news-releases/binance-and-mastercard-launch-prepaid-card-in-argentina-to-bridge-cryptocurrencies-and-everyday-purchases-301599811.html"
    },
    {
      "title": "",
      "url": "https://apps.apple.com/kz/app/surfcash/id6756326740"
    },
    {
      "title": "",
      "url": "https://www.westernunion.com/global/en/digital-assets-stablecoin.html"
    },
    {
      "title": "",
      "url": "https://www.tradingview.com/news/cointelegraph:7ed697bbf094b:0-argentina-bill-targets-crypto-payments-to-illegal-gambling-sites/"
    },
    {
      "title": "",
      "url": "https://www.atlanticcouncil.org/blogs/econographics/stablecoins-are-trending-but-what-frictions-and-risks-are-getting-overlooked/"
    },
    {
      "title": "",
      "url": "https://allpaypayz.com/en/news/argentina-launched-ai-to-predict-the-future-but-it-couldn-t-even-predict-a-typo"
    },
    {
      "title": "",
      "url": "https://www.youtube.com/watch?v=GtyuIf7zykA"
    },
    {
      "title": "",
      "url": "https://x.com/KAVA_CHAIN/status/2058896178578690561"
    },
    {
      "title": "",
      "url": "https://www.circle.com/case-studies/lemon"
    },
    {
      "title": "",
      "url": "https://www.binance.com/en/blog/payments/6809083748001075245"
    },
    {
      "title": "",
      "url": "https://www.binance.com/en-IN/square/post/302610417799777"
    },
    {
      "title": "",
      "url": "https://aibc.world/news/argentina-crypto-gambling-payments-bill/"
    },
    {
      "title": "",
      "url": "https://nexo.com/blog/nexo-official-digital-asset-partner-argentina-national-football-team-latam"
    },
    {
      "title": "",
      "url": "https://bingx.com/en/blog/article/bingx-names-world-champion-enzo-fernandez-as-global-ambassador"
    },
    {
      "title": "",
      "url": "https://x.com/Cardano/status/2041788449892540795"
    },
    {
      "title": "",
      "url": "https://ir.westernunion.com/news/archived-press-releases/press-release-details/2026/Western-Union-Launches-USDPT-on-Solana-Advancing-Regulated-Digital-Infrastructure-for-Global-Payments/default.aspx"
    },
    {
      "title": "",
      "url": "https://www.oobit.com/news/oobit-launches-in-argentina-as-stablecoin-spending-hits-72-of-all-user-transactions"
    }
  ],
  "schema_version": 1,
  "slug": "argentina",
  "summary": "Argentina has become a live stress test for stablecoins and crypto payments, where inflation, QR wallets, football culture and shifting regulation turn digital dollars into everyday money—and expose the risks and tradeoffs behind that adoption."
}
