{
  "citations": [],
  "schema_version": 1,
  "slug": "polygon",
  "summary": "Polygon is an Ethereum-aligned blockchain network and payment infrastructure layer, offering PoS-based scaling, ZK interoperability via AggLayer, and an Open Money Stack powering stablecoin payments for Mastercard, Cash App, and global fintechs."
}
