{
  "citations": [
    {
      "title": "",
      "url": "https://solana.com"
    },
    {
      "title": "",
      "url": "https://solana.com/news/year-in-review-2020"
    },
    {
      "title": "",
      "url": "https://docs.anza.xyz/implemented-proposals/tower-bft"
    },
    {
      "title": "",
      "url": "https://www.soltokenlaunch.com/solana-tokenomics/"
    },
    {
      "title": "",
      "url": "https://www.bleap.finance/blog/ethereum-vs-solana"
    },
    {
      "title": "",
      "url": "https://www.circle.com/usdc"
    },
    {
      "title": "",
      "url": "https://x.com/solana/status/2049741676693049672"
    },
    {
      "title": "",
      "url": "https://www.21shares.com/en-us/insights/solanas-diverse-revenue-engine-surpasses-ethereums-early-growth"
    },
    {
      "title": "",
      "url": "https://intellectia.ai/news/crypto/morgan-stanley-launches-014-ethereum-and-solana-etfs-pressuring-rivals"
    },
    {
      "title": "",
      "url": "https://www.instagram.com/reel/DZveAh-PcAN/"
    },
    {
      "title": "",
      "url": "https://ondo.finance/global-markets"
    },
    {
      "title": "",
      "url": "https://www.investing.com/news/cryptocurrency-news/first-block-onpharma-company-and-crito-capital-announce-first-solana-sto-for-us-medical-device-business-4746638"
    },
    {
      "title": "",
      "url": "https://www.helius.dev/blog/solana-etfs"
    },
    {
      "title": "",
      "url": "https://x.com/leviathan_news/status/2068129543995658486"
    },
    {
      "title": "",
      "url": "https://solana.com/news/proof-of-history"
    },
    {
      "title": "",
      "url": "https://www.ark-invest.com/articles/analyst-research/majority-fiat-backed-stablecoins-usdt-usdc-pyusd"
    },
    {
      "title": "",
      "url": "https://www.helius.dev/blog/solana-real-world-assets"
    },
    {
      "title": "",
      "url": "https://www.coingecko.com/en/coins/solana"
    },
    {
      "title": "",
      "url": "https://solana.com/news/solana-developer-platform"
    }
  ],
  "schema_version": 1,
  "slug": "solana",
  "summary": "Comprehensive explainer on Solana’s high-performance blockchain, covering PoH tech, SOL tokenomics, DeFi, tokenized equities, stablecoins, ETFs, institutional adoption, risks and outlook for its role in onchain markets."
}
