{
  "citations": [
    {
      "title": "",
      "url": "https://www.whitehouse.gov/fact-sheets/2025/07/fact-sheet-president-donald-j-trump-signs-genius-act-into-law/"
    },
    {
      "title": "",
      "url": "https://www.arnoldporter.com/en/perspectives/advisories/2025/07/new-stablecoin-legislation-analyzing-the-genius-act"
    },
    {
      "title": "",
      "url": "https://www.youtube.com/watch?v=PWMiF5aCYAI"
    },
    {
      "title": "",
      "url": "https://www.cov.com/en/news-and-insights/insights/2025/02/seven-things-to-know-about-the-federal-stablecoin-bill-the-genius-act"
    },
    {
      "title": "",
      "url": "https://democrats-financialservices.house.gov/news/documentsingle.aspx?DocumentID=412883"
    },
    {
      "title": "",
      "url": "https://www.hkma.gov.hk/eng/key-functions/international-financial-centre/stablecoin-issuers/"
    },
    {
      "title": "",
      "url": "https://www.parl.ca/documentviewer/en/45-1/bill/C-15/first-reading"
    },
    {
      "title": "",
      "url": "https://www.flsenate.gov/Session/Bill/2026/314"
    },
    {
      "title": "",
      "url": "https://www.atlanticcouncil.org/blogs/new-atlanticist/stablecoin-regulation-is-pending-in-congress-here-are-six-ways-the-proposals-should-be-improved/"
    },
    {
      "title": "",
      "url": "https://x.com/DecryptMedia/status/2036545968103960796"
    },
    {
      "title": "",
      "url": "https://www.mayerbrown.com/en/insights/publications/2025/07/hong-kongs-stablecoin-bill-key-amendments-and-next-steps-following-legislative-passage"
    },
    {
      "title": "",
      "url": "https://www.paulhastings.com/insights/crypto-policy-tracker/white-house-releases-stablecoin-yield-report-genius-act-regulations-advance"
    },
    {
      "title": "",
      "url": "https://www.bankingdive.com/news/senate-banking-committee-crypto-stablecoin-yield-scott-warren-warner-trump/820384/"
    },
    {
      "title": "",
      "url": "https://www.deloitte.com/ca/en/about/press-room/stablecorp-collaboration-strategique-infrastructure-cryptomonnaie-institutions-financieres-canadiennes.html"
    },
    {
      "title": "",
      "url": "https://www.lw.com/en/insights/the-genius-act-of-2025-stablecoin-legislation-adopted-in-the-us"
    },
    {
      "title": "",
      "url": "https://www.coinage.media/s4/why-the-senate-passing-the-genius-stablecoin-bill-just-broke-the-crypto-dam"
    },
    {
      "title": "",
      "url": "https://www.techmeme.com/230416/p7"
    },
    {
      "title": "",
      "url": "https://www.jonesday.com/en/insights/2025/06/senate-passes-genius-act-clearing-hurdle-for-federal-stablecoin-framework"
    },
    {
      "title": "",
      "url": "https://www.mexc.com/news/855509"
    }
  ],
  "schema_version": 1,
  "slug": "stablecoin-bill",
  "summary": "In‑depth explainer on emerging stablecoin bills, from the US GENIUS Act and yield fight to Hong Kong and Canada’s regimes, unpacking how new laws on reserves, licensing, and interest reshape USDC‑style tokens, DeFi, and the future of digital dollars."
}
