{
  "citations": [
    {
      "title": "",
      "url": "https://www.figma.com/resource-library/what-is-ux-design/"
    },
    {
      "title": "",
      "url": "https://www.purrweb.com/blog/blockchain-ux-design/"
    },
    {
      "title": "",
      "url": "https://x.com/zerokn0wledge_/status/1931012536549216491"
    },
    {
      "title": "",
      "url": "https://blog.ethereum.org/2026/02/18/protocol-priorities-update-2026"
    },
    {
      "title": "",
      "url": "https://x.com/ethereum/status/2041573357695459379"
    },
    {
      "title": "",
      "url": "https://x.com/aztecnetwork/status/2064046503304540622"
    },
    {
      "title": "",
      "url": "https://x.com/swarms_corp/status/2061482262232023153"
    },
    {
      "title": "",
      "url": "https://x.com/Dashpay/status/2040489269119058378"
    },
    {
      "title": "",
      "url": "https://blog.enso.build/page/2/"
    },
    {
      "title": "",
      "url": "https://x.com/blocmates/status/2044053483918372981"
    },
    {
      "title": "",
      "url": "https://x.com/jonah_b/article/2059318001657098296"
    },
    {
      "title": "",
      "url": "https://sailgp.com/prediction-markets/guide/kalshi-vs-robinhood"
    },
    {
      "title": "",
      "url": "https://oneclicktrading.com"
    },
    {
      "title": "",
      "url": "https://arbitrum.io/why-arbitrum/features/performance"
    },
    {
      "title": "",
      "url": "https://x.com/Offchain/status/2056760650383147268"
    },
    {
      "title": "",
      "url": "https://www.youtube.com/shorts/vs51txcm7lE"
    },
    {
      "title": "",
      "url": "https://united.network"
    },
    {
      "title": "",
      "url": "https://x.com/CryptoKaleo/status/2041290934374076762"
    },
    {
      "title": "",
      "url": "https://yellow.com/research/crypto-bridges-explained-fees-risks-and-why-cross-chain-ux-still-lags-in-2025"
    },
    {
      "title": "",
      "url": "https://www.uxtigers.com/post/2026-predictions"
    }
  ],
  "schema_version": 1,
  "slug": "ux",
  "summary": "Deep dive explainer on UX in crypto and DeFi, covering wallets, bridges, L1/L2 design, AI agents, privacy, and Ethereum’s protocol roadmap, with examples from Arbitrum, Aztec, Sui and more, plus best practices for builders."
}
