{
  "citations": [],
  "schema_version": 1,
  "slug": "paradigm",
  "summary": "Paradigm is a crypto-native VC and research firm co-founded by Matt Huang and Fred Ehrsam, known for DeFi investments, open-source tooling, policy advocacy, and emerging product development in prediction markets and stablecoin infrastructure."
}
