{
  "citations": [
    {
      "title": "",
      "url": "https://en.wikipedia.org/wiki/Lazarus_Group"
    },
    {
      "title": "",
      "url": "https://www.trmlabs.com/resources/blog/north-korea-stole-76-of-all-crypto-hack-value-in-2026-with-just-two-attacks?scLang=en"
    },
    {
      "title": "",
      "url": "https://pricepredictions.com/news/g7-north-korea-crypto-theft-geopolitical-security-threat-evian-communique-june-2026-3izttqvw"
    },
    {
      "title": "",
      "url": "http://ungukabank.com/north-korean-crypto-hackers-stole-2-1b-in-2025-60-of-all-losses-certik/"
    },
    {
      "title": "",
      "url": "https://www.newsfilecorp.com/release/297306/Crystal-Intelligence-Report-South-Korea-Traces-7.1B-in-Illicit-Crypto-as-North-Korean-Hackers-Strike"
    },
    {
      "title": "",
      "url": "https://www.elliptic.co/blog/north-korea-linked-hackers-have-already-stolen-over-2-billion-in-2025"
    },
    {
      "title": "",
      "url": "https://x.com/WuBlockchain/status/2061662229850886564"
    },
    {
      "title": "",
      "url": "https://x.com/WuBlockchain/status/2065502530310975576"
    },
    {
      "title": "",
      "url": "https://www.cryptoisac.org/news-member-content/north-korean-hackers-are-infiltrating-crypto-companies-ripple-and-crypto-isac-are-sharing-the-intelligence-to-help-stop-them"
    },
    {
      "title": "",
      "url": "https://www.instagram.com/p/DZm_G39kYbv/"
    },
    {
      "title": "",
      "url": "https://www.chainalysis.com/blog/crypto-hacking-stolen-funds-2026/"
    },
    {
      "title": "",
      "url": "https://www.crowdfundinsider.com/2026/05/278940-north-korea-linked-actors-have-turned-crypto-theft-into-revenue-engine-for-regime-analysis/"
    },
    {
      "title": "",
      "url": "https://www.cyberproof.com/blog/crypto-social-engineering-north-korean-apts-in-2024/"
    },
    {
      "title": "",
      "url": "https://industrialcyber.co/threats-attacks/north-koreas-state-sponsored-apt-tradertraitor-targets-blockchain-technology-cryptocurrency-industry/"
    },
    {
      "title": "",
      "url": "https://www.cloudflare.com/learning/security/ransomware/wannacry-ransomware/"
    },
    {
      "title": "",
      "url": "https://www.justice.gov/opa/pr/two-us-nationals-sentenced-facilitating-fraudulent-remote-information-technology-worker-0"
    },
    {
      "title": "",
      "url": "https://www.elysee.fr/en/G7evian/2026/06/17/g7-leaders-statement-on-geopolitical-issues"
    },
    {
      "title": "",
      "url": "https://www.elliptic.co/blog/how-the-lazarus-group-is-stepping-up-crypto-hacks-and-changing-its-tactics"
    },
    {
      "title": "",
      "url": "https://www.cyfirma.com/research/dprk-sanctions-violations-in-cyber-operations-post-un-panel-demise/"
    },
    {
      "title": "",
      "url": "https://en.wikipedia.org/wiki/North_Korean_remote_worker_scheme"
    }
  ],
  "schema_version": 1,
  "slug": "north-korea",
  "summary": "Deep dive on how North Korea’s Lazarus-led hacker ecosystem steals and launders billions in crypto, the tactics behind major DPRK-linked exploits, and what this evolving threat means for exchanges, DeFi and users."
}
