{
  "citations": [
    {
      "title": "",
      "url": "https://www.paxos.com/company"
    },
    {
      "title": "",
      "url": "https://www.paxos.com/pyusd-transparency"
    },
    {
      "title": "",
      "url": "https://www.paxos.com/newsroom/sec-registers-paxos-securities-settlement-company-as-a-clearing-agency"
    },
    {
      "title": "",
      "url": "https://thedefiant.io/converge/tradfi-and-fintech/house-of-doge-paxos-push-dogecoin-paypal-venmo-interactive-brokers"
    },
    {
      "title": "",
      "url": "https://www.prnewswire.com/news-releases/paxos-labs-launches-amplify-the-financial-utility-stack-for-digital-assets-302739970.html"
    },
    {
      "title": "",
      "url": "https://www.paxos.com/blog/paxos-partner-rewards-engine"
    },
    {
      "title": "",
      "url": "https://x.com/theblockopedia_/status/2068339697089233079"
    },
    {
      "title": "",
      "url": "https://www.paxos.com/newsroom/paxos-prevails-in-sec-investigation-of-busd-stablecoin-and-sec-will-not-pursue-enforcement-action"
    },
    {
      "title": "",
      "url": "https://www.paxos.com/usdp"
    },
    {
      "title": "",
      "url": "https://www.paxos.com/pax-gold"
    },
    {
      "title": "",
      "url": "https://www.paxos.com/newsroom/global-dollar-(usdg)-launches-in-the-eu"
    },
    {
      "title": "",
      "url": "https://www.paxos.com"
    },
    {
      "title": "",
      "url": "https://www.facebook.com/BROKSTOCK/posts/-heres-whats-been-happening-on-the-digital-markets-indexes-fear-dominated-the-cr/965763629299515/"
    },
    {
      "title": "",
      "url": "https://aon.mediaroom.com/2026-03-09-Aon-Announces-First-Stablecoin-Insurance-Premium-Payment"
    },
    {
      "title": "",
      "url": "https://www.paxos.com/blog/approvals-audit-logs-webhooks-and-more-what-s-new-in-paxos-dashboard"
    },
    {
      "title": "",
      "url": "https://www.paxos.com/blog/third-party-custody"
    },
    {
      "title": "",
      "url": "https://www.raptorgroup.com/tag/paxos/"
    }
  ],
  "schema_version": 1,
  "slug": "paxos",
  "summary": "Deep explainer on Paxos, covering its regulated stablecoins, PayPal partnership, PAXG gold token, SEC-cleared securities platform, Amplify yield stack, Dogecoin support, and role connecting crypto, DeFi and traditional finance."
}
