{
  "citations": [],
  "schema_version": 1,
  "slug": "standard-chartered",
  "summary": "Standard Chartered is building an integrated institutional crypto stack spanning custody (Zodia), Hong Kong stablecoin issuance, fiat rails, and RWA tokenisation research — while publishing Bitcoin and Ethereum price targets that move markets."
}
