{
  "citations": [
    {
      "title": "",
      "url": "https://www.ark-funds.com"
    },
    {
      "title": "",
      "url": "https://www.ark-funds.com/funds/arkb"
    },
    {
      "title": "",
      "url": "https://github.com/ArkEcosystem/core"
    },
    {
      "title": "",
      "url": "https://arkconnect.io"
    },
    {
      "title": "",
      "url": "https://arkvault.io"
    },
    {
      "title": "",
      "url": "https://www.youtube.com/watch?v=_ngYkcJlot8"
    },
    {
      "title": "",
      "url": "https://x.com/ArkEcosystem/status/2052073458813620325"
    },
    {
      "title": "",
      "url": "https://www.facebook.com/ArkEcosystem/photos/d41d8cd9/1563438460431113/"
    },
    {
      "title": "",
      "url": "https://www.ark-funds.com/funds/arkk"
    },
    {
      "title": "",
      "url": "https://www.federalregister.gov/documents/2024/09/24/2024-21752/self-regulatory-organizations-cboe-bzx-exchange-inc-notice-of-filing-and-immediate-effectiveness-of"
    },
    {
      "title": "",
      "url": "https://coinmarketcap.com/currencies/ark/"
    },
    {
      "title": "",
      "url": "https://ark.dev/docs/desktop-wallet/introduction-to-ark-rewards"
    },
    {
      "title": "",
      "url": "https://arkvault.io/docs"
    },
    {
      "title": "",
      "url": "https://live.arkscan.io"
    },
    {
      "title": "",
      "url": "https://stockcircle.com/portfolio/cathie-wood/coin/transactions"
    },
    {
      "title": "",
      "url": "https://coinmarketcap.com/academy/article/ark-invest-buys-dollar13m-in-robinhood-after-trump-accounts-deal"
    },
    {
      "title": "",
      "url": "https://www.ark-invest.com/articles/analyst-research/prediction-markets-potential-multi-trillion-dollar-asset-class"
    },
    {
      "title": "",
      "url": "https://www.eqs-news.com/news/corporate/eightco-nasdaq-orbs-secures-125m-in-institutional-commitments-led-by-bitmine-nyse-bmnr-cathie-woods-ark-invest-and-payward-to-expand-into-next-generation-technology/81b832a3-742b-4f9e-9009-0d277b8451e9_en"
    },
    {
      "title": "",
      "url": "https://phemex.com/news/article/ark-invest-warns-346-of-bitcoin-supply-at-risk-from-quantum-computing-66089"
    },
    {
      "title": "",
      "url": "https://x.com/CoinDesk/status/2056348904547922187"
    }
  ],
  "schema_version": 1,
  "slug": "ark",
  "summary": "Deep explainer on “ARK” in crypto, covering the ARK blockchain (DPoS, Mainsail, ARKVault, ARK Connect) and ARK Invest (ARKB Bitcoin ETF, ARKK, Coinbase/Robinhood stakes, Kalshi ties, quantum risk research) and how these strands shape digital asset markets."
}
