{
  "citations": [
    {
      "title": "",
      "url": "https://coinmarketcap.com/academy/glossary/whitepaper"
    },
    {
      "title": "",
      "url": "https://ethereum.org/whitepaper/"
    },
    {
      "title": "",
      "url": "https://www.esma.europa.eu/esmas-activities/digital-finance-and-innovation/markets-crypto-assets-regulation-mica"
    },
    {
      "title": "",
      "url": "https://www.coinbase.com/learn/crypto-basics/bitcoin-whitepaper-simplified-for-everyone"
    },
    {
      "title": "",
      "url": "https://www.meegle.com/en_us/topics/tokenomics/white-paper-requirements-for-tokens"
    },
    {
      "title": "",
      "url": "https://www.stacks.co"
    },
    {
      "title": "",
      "url": "https://x.com/osldotcom/status/2066474045814849594"
    },
    {
      "title": "",
      "url": "https://x.com/SeiNetwork/status/2061859609942581471"
    },
    {
      "title": "",
      "url": "https://x.com/Stable/status/2067250398109585751"
    },
    {
      "title": "",
      "url": "https://www.ark-invest.com/white-papers/bitcoin-and-quantum-computing"
    },
    {
      "title": "",
      "url": "https://hackmd.io/@lido/v3-whitepaper"
    },
    {
      "title": "",
      "url": "https://en.wikipedia.org/wiki/TON_(blockchain)"
    },
    {
      "title": "",
      "url": "https://www.twobirds.com/en/insights/2024/global/a-different-way-to-defraud-the-lessons-from-the-trial-of-bitcoins-origins"
    },
    {
      "title": "",
      "url": "https://thatwhitepaperguy.com/10-tips-ico-white-papers/"
    },
    {
      "title": "",
      "url": "https://www.bitstamp.net/faq/what-is-a-crypto-asset-white-paper/"
    },
    {
      "title": "",
      "url": "https://multichainz.com/governance"
    },
    {
      "title": "",
      "url": "https://x.com/CROSS_gamechain/status/2027236985480323530"
    },
    {
      "title": "",
      "url": "https://x.com/AVAFoundation/status/2057703001645515231"
    }
  ],
  "schema_version": 1,
  "slug": "white-paper",
  "summary": "In crypto, white papers are foundational documents that define how protocols and tokens work, from Bitcoin to DeFi, stablecoins and AI agents. Learn what they are, how MiCA reshapes them, and how to read them critically to assess risks, incentives and liquidity."
}
