{
  "citations": [
    {
      "title": "LlamaRisk Services Proposal, April 2025-2026 (Curve Governance)",
      "url": "https://gov.curve.finance/t/llamarisk-services-proposal-april-2025-2026/10489"
    },
    {
      "title": "LlamaRisk: Concluding Our Curve Engagement",
      "url": "https://gov.curve.finance/t/llamarisk-concluding-our-curve-engagement/11090"
    },
    {
      "title": "Scaling YieldBasis to $1B (Pangea Foundation)",
      "url": "https://blog.pangea.foundation/scaling-yieldbasis-to-1bn/"
    },
    {
      "title": "LlamaRisk: Ensuring Continuity of Aave's Risk Management",
      "url": "https://governance.aave.com/t/llamarisk-ensuring-continuity-of-aaves-risk-management/24397"
    },
    {
      "title": "ARFC: Renew LlamaRisk as Risk Service Provider (Epoch 4)",
      "url": "https://governance.aave.com/t/arfc-renew-llamarisk-as-risk-service-provider-epoch-4/24446"
    },
    {
      "title": "Ethena Risk Committee Elections: Fourth Term Results",
      "url": "https://gov.ethenafoundation.com/t/ethena-risk-committee-elections-fourth-term-results/750"
    },
    {
      "title": "LlamaGuard Release (LlamaRisk Research)",
      "url": "https://www.llamarisk.com/research/llamaguard-release"
    },
    {
      "title": "LlamaRisk Research Portal",
      "url": "https://portal.llamarisk.com/"
    }
  ],
  "schema_version": 1,
  "slug": "llamarisk",
  "summary": "LlamaRisk is a DeFi risk research firm holding active mandates across Aave and Ethena, and a former Curve Finance mandate — producing governance proposals, incident analysis, oracle infrastructure, and regulatory research to protect protocol users."
}
