{
  "citations": [
    {
      "title": "",
      "url": "https://coinmarketcap.com"
    },
    {
      "title": "",
      "url": "https://kalshi.com"
    },
    {
      "title": "",
      "url": "https://www.facebook.com/CoinMarketCap/posts/latest-charles-schwab-is-working-with-cboe-global-markets-to-roll-out-all-or-not/1430143249143064/"
    },
    {
      "title": "",
      "url": "https://x.com/WuBlockchain/status/2068044895915225447"
    },
    {
      "title": "",
      "url": "https://pricepredictions.com/news/msusd-drops-85-percent-mainstreet-finance-morpho-100-utilization-june-2026-qyhl2i43"
    },
    {
      "title": "",
      "url": "https://www.youtube.com/watch?v=WZ7mmTrSgxI"
    },
    {
      "title": "",
      "url": "https://www.facebook.com/vnzabbar/posts/breaking-strc-is-now-trading-near-its-record-low-zone-around-86-far-below-its-10/1572500064444020/"
    },
    {
      "title": "",
      "url": "https://www.curtis.senate.gov/press-releases/curtis-slotkin-young-schiff-lead-bipartisan-bill-to-stop-insider-trading-from-government-officials-on-prediction-markets/"
    },
    {
      "title": "",
      "url": "https://a16zcrypto.com/posts/tags/prediction-markets"
    },
    {
      "title": "",
      "url": "https://polymarket.com"
    },
    {
      "title": "",
      "url": "https://robinhood.com/us/en/prediction-markets/"
    },
    {
      "title": "",
      "url": "https://www.coinbase.com/predictions"
    },
    {
      "title": "",
      "url": "https://x.com/WuBlockchain/status/2068102593658990635"
    },
    {
      "title": "",
      "url": "https://www.gurufocus.com/news/8924462/charles-schwab-schw-launches-new-yesorno-options-tied-to-sp-500?mobile=true"
    },
    {
      "title": "",
      "url": "https://www.facebook.com/cnbc/posts/republican-house-member-rep-bryan-steil-on-thursday-is-set-to-introduce-a-provis/1401689635165759/"
    },
    {
      "title": "",
      "url": "https://www.thestreet.com/crypto/markets/hyperliquid-loses-anthropic-openai-markets"
    },
    {
      "title": "",
      "url": "https://metamask.io/news/perpetual-futures-vs-spot-bitcoin"
    },
    {
      "title": "",
      "url": "https://www.nerdwallet.com/investing/learn/what-are-prediction-markets"
    },
    {
      "title": "",
      "url": "https://www.instagram.com/reel/DXhOsQYB-GU/"
    },
    {
      "title": "",
      "url": "https://www.youtube.com/watch?v=puiJC9YVax0"
    }
  ],
  "schema_version": 1,
  "slug": "markets",
  "summary": "Deep explainer on crypto markets, from Bitcoin spot and USDC DeFi lending to perpetual futures and prediction markets, covering microstructure, regulation, AI trends, risks, and what growing event-based markets mean for traders."
}
