{
  "citations": [
    {
      "title": "",
      "url": "https://chain.link/education/blockchain-oracles"
    },
    {
      "title": "",
      "url": "http://www.fca.org.uk/publication/research-notes/research-note-review-and-maximal-extractable-value-blockchain-oracles.pdf"
    },
    {
      "title": "",
      "url": "https://chain.link"
    },
    {
      "title": "",
      "url": "https://www.youtube.com/watch?v=MqRfurKVM1A"
    },
    {
      "title": "",
      "url": "https://blog.redstone.finance/2024/10/23/redstone-restaking-oracle-utilizing-eigenlayer-to-tap-into-cryptoeconomic-security/"
    },
    {
      "title": "",
      "url": "https://www.diadata.org"
    },
    {
      "title": "",
      "url": "https://forum.morpho.org/t/new-oev-boosted-vaults-by-yearn-api3/1833"
    },
    {
      "title": "",
      "url": "https://chaoslabs.xyz/oracles"
    },
    {
      "title": "",
      "url": "https://frax.com/bamm"
    },
    {
      "title": "",
      "url": "https://www.nascent.xyz/idea/why-defi-is-broken-and-how-to-fix-it-pt-1-oracle-free-protocols"
    },
    {
      "title": "",
      "url": "https://www.tradingview.com/news/cointelegraph:50edbdcc0094b:0-chaos-labs-says-oracles-secure-after-attempted-nation-state-wallet-attack/"
    },
    {
      "title": "",
      "url": "https://www.instagram.com/reel/DWt274xiLZo/"
    },
    {
      "title": "",
      "url": "https://x.com/ammalgam/status/1899161993086369972"
    },
    {
      "title": "",
      "url": "https://www.instagram.com/reel/DNRDgQ2P7KF/"
    },
    {
      "title": "",
      "url": "https://github.com/ora-io/OAO"
    },
    {
      "title": "",
      "url": "https://llamarisk.com/research/risk-alternative-prisma-oracles-comparative-analysis"
    },
    {
      "title": "",
      "url": "https://blog.redstone.finance/2025/05/28/redstone-rwa-oracle-brings-tokenized-assets-to-solana-ecosystem/"
    }
  ],
  "schema_version": 1,
  "slug": "oracles",
  "summary": "In-depth explainer on blockchain oracles: how they connect DeFi to real-world data, power lending, RWAs, and AI, the risks and MEV they introduce, and why oracle-free designs like BAMM and Ammalgam are reshaping onchain finance."
}
