{
  "citations": [
    {
      "title": "",
      "url": "https://www.dtcc.com/about/businesses-and-subsidiaries/dtc"
    },
    {
      "title": "",
      "url": "https://www.dtcc.com/news/2025/december/11/paving-the-way-to-tokenized-dtc-custodied-assets"
    },
    {
      "title": "",
      "url": "https://www.dtcc.com/news/2026/may/12/dtcc-collaborates-with-chainlink-to-advance-24-7-collateral-management"
    },
    {
      "title": "",
      "url": "https://www.canton.network/dtc-and-fed-eligible-securities-on-canton"
    },
    {
      "title": "",
      "url": "https://www.youtube.com/watch?v=lMaIoOcTZdM"
    },
    {
      "title": "",
      "url": "https://www.carltonfields.com/insights/publications/2025/sec-staff-no-action-letter-to-dtc-for-tokenization-services"
    },
    {
      "title": "",
      "url": "https://www.dtcc.com/dtcc-connection/articles/2026/april/29/one-year-later-how-dtccs-great-global-collateral-experiment-changed-the-conversation"
    },
    {
      "title": "",
      "url": "https://www.dtcc.com/news/2026/may/13/tokenized-collateral-could-unlock-billions-in-capital-and-transform-liquidity-management"
    },
    {
      "title": "",
      "url": "https://www.citigroup.com/rcs/citigpa/storage/public/Citi_Institute_GPS_Report_Tokenization_2030.pdf"
    },
    {
      "title": "",
      "url": "https://www.dtcc.com/news/2026/may/04/dtcc-advances-development-of-new-tokenization-service"
    },
    {
      "title": "",
      "url": "https://www.dtcc.com/digital-assets/collateral-appchain"
    },
    {
      "title": "",
      "url": "https://x.com/CantonNetwork/status/2057834366022422921"
    },
    {
      "title": "",
      "url": "https://www.northerntrust.com/united-states/pr/2026/northern-trust-builds-tokenized-asset-custody-capabilities-on-the-canton-network"
    },
    {
      "title": "",
      "url": "https://www.dtcc.com/news/2026/may/27/tokenization-service-to-connect-with-stellar-public-blockchain-as-dtc-advances-multi-chain-strategy"
    },
    {
      "title": "",
      "url": "https://www.itcpeacademy.org/blog/news-dtcc-to-bring-tokenized-securities-to-the-stellar-blockchain-by-2027"
    },
    {
      "title": "",
      "url": "https://www.dtcc.com/accelerated-settlement"
    },
    {
      "title": "",
      "url": "https://www.dtcc.com/digital-assets/tokenization"
    }
  ],
  "schema_version": 1,
  "slug": "dtcc",
  "summary": "In‑depth explainer of DTCC’s role in Wall Street markets and its push into tokenization, Canton, Chainlink, and Stellar, outlining how DTC‑custodied securities and collateral are moving onchain and what it means for crypto and DeFi."
}
